# 8. Capture IP Address Packets

root@lamponubuntu2404-s-1vcpu-1gb-tor1-01:~# tcpdump -n -i eth0
tcpdump: verbose output suppressed, use -v[v]... for full protocol decode
listening on eth0, link-type EN10MB (Ethernet), snapshot length 262144 bytes
02:08:21.115828 IP 99.237.196.67.52615 > 138.197.147.137.22: Flags [.], ack 3275297399, win 38814, options [nop,nop,TS val 299335034 ecr 1139707985], length 0
02:08:21.117363 IP 138.197.147.137.22 > 99.237.196.67.52615: Flags [P.], seq 85:193, ack 0, win 519, options [nop,nop,TS val 1139708003 ecr 299335034], length 108
02:08:21.117429 IP 138.197.147.137.22 > 99.237.196.67.52615: Flags [P.], seq 193:229, ack 0, win 519, options [nop,nop,TS val 1139708003 ecr 299335034], length 36
02:08:21.117486 IP 138.197.147.137.22 > 99.237.196.67.52615: Flags [P.], seq 229:281, ack 0, win 519, options [nop,nop,TS val 1139708003 ecr 299335034], length 52
02:08:21.117534 IP 138.197.147.137.22 > 99.237.196.67.52615: Flags [P.], seq 281:349, ack 0, win 519, options [nop,nop,TS val 1139708003 ecr 299335034], length 68
02:08:21.117577 IP 138.197.147.137.22 > 99.237.196.67.52615: Flags [P.], seq 349:417, ack 0, win 519, options [nop,nop,TS val 1139708003 ecr 299335034], length 68
02:08:21.117677 IP 138.197.147.137.22 > 99.237.196.67.52615: Flags [P.], seq 417:453, ack 0, win 519, options [nop,nop,TS val 1139708004 ecr 299335034], length 36
02:08:21.131054 IP 99.237.196.67.52615 > 138.197.147.137.22: Flags [.], ack 85, win 38813, options [nop,nop,TS val 299335043 ecr 1139707996], length 0
02:08:21.131054 IP 99.237.196.67.52615 > 138.197.147.137.22: Flags [.], ack 281, win 38814, options [nop,nop,TS val 299335050 ecr 1139708003], length 0
02:08:21.131781 IP 172.68.138.158.14290 > 138.197.147.137.59357: Flags [S], seq 1272289265, win 65535, options [mss 1460,sackOK,TS val 1651572876 ecr 0,nop,wscale 13], length 0
02:08:21.137417 IP 99.237.196.67.52615 > 138.197.147.137.22: Flags [.], ack 453, win 38814, options [nop,nop,TS val 299335051 ecr 1139708004], length 0
02:08:21.137417 IP 99.237.196.67.52615 > 138.197.147.137.22: Flags [P.], seq 0:36, ack 85, win 38814, options [nop,nop,TS val 299335047 ecr 1139707996], length 36
02:08:21.137576 IP 138.197.147.137.22 > 99.237.196.67.52615: Flags [P.], seq 453:489, ack 36, win 519, options [nop,nop,TS val 1139708023 ecr 299335043], length 36
02:08:21.152815 IP 99.237.196.67.52615 > 138.197.147.137.22: Flags [P.], seq 36:72, ack 489, win 38814, options [nop,nop,TS val 299335070 ecr 1139708023], length 36
02:08:21.152816 IP 99.237.196.67.52615 > 138.197.147.137.22: Flags [.], ack 489, win 38814, options [nop,nop,TS val 299335070 ecr 1139708023], length 0
02:08:21.152972 IP 138.197.147.137.22 > 99.237.196.67.52615: Flags [P.], seq 489:525, ack 72, win 519, options [nop,nop,TS val 1139708039 ecr 299335070], length 36
02:08:21.169875 IP 99.237.196.67.52615 > 138.197.147.137.22: Flags [.], ack 525, win 38814, options [nop,nop,TS val 299335086 ecr 1139708039], length 0
02:08:21.176310 IP 99.237.196.67.52615 > 138.197.147.137.22: Flags [P.], seq 72:108, ack 525, win 38814, options [nop,nop,TS val 299335092 ecr 1139708039], length 36
02:08:21.176468 IP 138.197.147.137.22 > 99.237.196.67.52615: Flags [P.], seq 525:561, ack 108, win 519, options [nop,nop,TS val 1139708062 ecr 299335092], length 36
02:08:21.189486 IP 41.59.86.232.60124 > 138.197.147.137.22: Flags [S], seq 3398473876, win 64240, options [mss 1460,sackOK,TS val 1495788020 ecr 0,nop,wscale 7], length 0
02:08:21.189540 IP 138.197.147.137 > 41.59.86.232: ICMP 138.197.147.137 tcp port 22 unreachable, length 68
02:08:21.197927 IP 99.237.196.67.52615 > 138.197.147.137.22: Flags [P.], seq 108:144, ack 561, win 38814, options [nop,nop,TS val 299335114 ecr 1139708062], length 36
02:08:21.197927 IP 99.237.196.67.52615 > 138.197.147.137.22: Flags [.], ack 561, win 38814, options [nop,nop,TS val 299335109 ecr 1139708062], length 0
02:08:21.198080 IP 138.197.147.137.22 > 99.237.196.67.52615: Flags [P.], seq 561:597, ack 144, win 519, options [nop,nop,TS val 1139708084 ecr 299335114], length 36
02:08:21.219170 IP 138.197.147.137.22 > 99.237.196.67.52615: Flags [P.], seq 597:793, ack 144, win 519, options [nop,nop,TS val 1139708105 ecr 299335114], length 196
02:08:21.219438 IP 99.237.196.67.52615 > 138.197.147.137.22: Flags [.], ack 597, win 38814, options [nop,nop,TS val 299335138 ecr 1139708084], length 0
02:08:21.219438 IP 99.237.196.67.52615 > 138.197.147.137.22: Flags [P.], seq 144:180, ack 561, win 38814, options [nop,nop,TS val 299335138 ecr 1139708062], length 36
02:08:21.219615 IP 138.197.147.137.22 > 99.237.196.67.52615: Flags [P.], seq 793:2481, ack 180, win 519, options [nop,nop,TS val 1139708105 ecr 299335138], length 1688
02:08:21.219758 IP 138.197.147.137.22 > 99.237.196.67.52615: Flags [P.], seq 2481:2853, ack 180, win 519, options [nop,nop,TS val 1139708106 ecr 299335138], length 372
02:08:21.219897 IP 138.197.147.137.22 > 99.237.196.67.52615: Flags [P.], seq 2853:3529, ack 180, win 519, options [nop,nop,TS val 1139708106 ecr 299335138], length 676
02:08:21.220039 IP 138.197.147.137.22 > 99.237.196.67.52615: Flags [P.], seq 3529:4069, ack 180, win 519, options [nop,nop,TS val 1139708106 ecr 299335138], length 540
02:08:21.220114 IP 138.197.147.137.22 > 99.237.196.67.52615: Flags [P.], seq 4069:4217, ack 180, win 519, options [nop,nop,TS val 1139708106 ecr 299335138], length 148
02:08:21.220206 IP 138.197.147.137.22 > 99.237.196.67.52615: Flags [P.], seq 4217:4573, ack 180, win 519, options [nop,nop,TS val 1139708106 ecr 299335138], length 356
02:08:21.220301 IP 138.197.147.137.22 > 99.237.196.67.52615: Flags [P.], seq 4573:4777, ack 180, win 519, options [nop,nop,TS val 1139708106 ecr 299335138], length 204
02:08:21.220389 IP 138.197.147.137.22 > 99.237.196.67.52615: Flags [P.], seq 4777:4813, ack 180, win 519, options [nop,nop,TS val 1139708106 ecr 299335138], length 36
02:08:21.241100 IP 99.237.196.67.52615 > 138.197.147.137.22: Flags [P.], seq 180:216, ack 4813, win 38814, options [nop,nop,TS val 299335159 ecr 1139708106], length 36
02:08:21.241101 IP 99.237.196.67.52615 > 138.197.147.137.22: Flags [.], ack 793, win 38814, options [nop,nop,TS val 299335152 ecr 1139708105], length 0
02:08:21.241101 IP 99.237.196.67.52615 > 138.197.147.137.22: Flags [.], ack 4069, win 38795, options [nop,nop,TS val 299335153 ecr 1139708106], length 0
02:08:21.241101 IP 99.237.196.67.52615 > 138.197.147.137.22: Flags [.], ack 4813, win 38810, options [nop,nop,TS val 299335154 ecr 1139708106], length 0
02:08:21.241309 IP 138.197.147.137.22 > 99.237.196.67.52615: Flags [P.], seq 4813:4849, ack 216, win 519, options [nop,nop,TS val 1139708127 ecr 299335159], length 36
02:08:21.258370 IP 99.237.196.67.52615 > 138.197.147.137.22: Flags [.], ack 4849, win 38814, options [nop,nop,TS val 299335177 ecr 1139708127], length 0
02:08:21.264832 IP 99.237.196.67.52615 > 138.197.147.137.22: Flags [P.], seq 216:252, ack 4849, win 38814, options [nop,nop,TS val 299335179 ecr 1139708127], length 36
02:08:21.264992 IP 138.197.147.137.22 > 99.237.196.67.52615: Flags [P.], seq 4849:4885, ack 252, win 519, options [nop,nop,TS val 1139708151 ecr 299335179], length 36
02:08:21.272676 IP 172.70.50.125.10180 > 138.197.147.137.59357: Flags [S], seq 1455993410, win 65535, options [mss 1460,sackOK,TS val 2338826982 ecr 0,nop,wscale 13], length 0
02:08:21.284312 IP 99.237.196.67.52615 > 138.197.147.137.22: Flags [P.], seq 252:288, ack 4885, win 38814, options [nop,nop,TS val 299335200 ecr 1139708151], length 36
02:08:21.284313 IP 99.237.196.67.52615 > 138.197.147.137.22: Flags [.], ack 4885, win 38814, options [nop,nop,TS val 299335197 ecr 1139708151], length 0
02:08:21.284486 IP 138.197.147.137.22 > 99.237.196.67.52615: Flags [P.], seq 4885:4921, ack 288, win 519, options [nop,nop,TS val 1139708170 ecr 299335200], length 36
02:08:21.297318 IP 99.237.196.67.52615 > 138.197.147.137.22: Flags [.], ack 4921, win 38814, options [nop,nop,TS val 299335217 ecr 1139708170], length 0
02:08:21.323353 IP 138.197.147.137.22 > 99.237.196.67.52615: Flags [P.], seq 4921:7817, ack 288, win 519, options [nop,nop,TS val 1139708209 ecr 299335217], length 2896
02:08:21.323377 IP 138.197.147.137.22 > 99.237.196.67.52615: Flags [P.], seq 7817:8909, ack 288, win 519, options [nop,nop,TS val 1139708209 ecr 299335217], length 1092
02:08:21.363689 IP 138.197.147.137.22 > 99.237.196.67.52615: Flags [P.], seq 7817:8909, ack 288, win 519, options [nop,nop,TS val 1139708250 ecr 299335217], length 1092
02:08:21.392356 IP 99.237.196.67.52615 > 138.197.147.137.22: Flags [.], ack 8909, win 38752, options [nop,nop,TS val 299335311 ecr 1139708209,nop,nop,sack 1 {7817:8909}], length 0
02:08:21.392357 IP 99.237.196.67.52615 > 138.197.147.137.22: Flags [.], ack 8909, win 38814, options [nop,nop,TS val 299335311 ecr 1139708209], length 0
02:08:21.392357 IP 99.237.196.67.52615 > 138.197.147.137.22: Flags [P.], seq 288:324, ack 4921, win 38814, options [nop,nop,TS val 299335221 ecr 1139708170], length 36
02:08:21.392464 IP 162.158.63.52.12415 > 138.197.147.137.59357: Flags [S], seq 1479478562, win 65535, options [mss 1460,sackOK,TS val 3727943691 ecr 0,nop,wscale 13], length 0
02:08:21.392585 IP 138.197.147.137.22 > 99.237.196.67.52615: Flags [P.], seq 8909:8945, ack 324, win 519, options [nop,nop,TS val 1139708278 ecr 299335217], length 36
02:08:21.398837 IP 99.237.196.67.52615 > 138.197.147.137.22: Flags [P.], seq 324:360, ack 4921, win 38814, options [nop,nop,TS val 299335247 ecr 1139708170], length 36
02:08:21.398837 IP 99.237.196.67.52615 > 138.197.147.137.22: Flags [.], ack 8945, win 38814, options [nop,nop,TS val 299335325 ecr 1139708278], length 0
02:08:21.398837 IP 99.237.196.67.52615 > 138.197.147.137.22: Flags [P.], seq 360:396, ack 4921, win 38814, options [nop,nop,TS val 299335273 ecr 1139708170], length 36
02:08:21.398837 IP 99.237.196.67.52615 > 138.197.147.137.22: Flags [P.], seq 396:432, ack 4921, win 38814, options [nop,nop,TS val 299335297 ecr 1139708170], length 36
02:08:21.398837 IP 99.237.196.67.52615 > 138.197.147.137.22: Flags [P.], seq 432:468, ack 8909, win 38814, options [nop,nop,TS val 299335318 ecr 1139708209], length 36
02:08:21.398990 IP 138.197.147.137.22 > 99.237.196.67.52615: Flags [.], ack 468, win 519, options [nop,nop,TS val 1139708285 ecr 299335247], length 0
02:08:21.399063 IP 138.197.147.137.22 > 99.237.196.67.52615: Flags [P.], seq 8945:9089, ack 468, win 519, options [nop,nop,TS val 1139708285 ecr 299335247], length 144
02:08:21.420407 IP 99.237.196.67.52615 > 138.197.147.137.22: Flags [P.], seq 468:504, ack 9089, win 38814, options [nop,nop,TS val 299335339 ecr 1139708285], length 36
02:08:21.420407 IP 99.237.196.67.52615 > 138.197.147.137.22: Flags [.], ack 9089, win 38814, options [nop,nop,TS val 299335332 ecr 1139708285], length 0
02:08:21.420592 IP 138.197.147.137.22 > 99.237.196.67.52615: Flags [P.], seq 9089:9125, ack 504, win 519, options [nop,nop,TS val 1139708306 ecr 299335339], length 36
02:08:21.426943 IP 138.197.147.137.22 > 99.237.196.67.52615: Flags [P.], seq 9125:9329, ack 504, win 519, options [nop,nop,TS val 1139708313 ecr 299335339], length 204
02:08:21.427287 IP 138.197.147.137.22 > 99.237.196.67.52615: Flags [P.], seq 9329:10389, ack 504, win 519, options [nop,nop,TS val 1139708313 ecr 299335339], length 1060
02:08:21.427368 IP 138.197.147.137.22 > 99.237.196.67.52615: Flags [P.], seq 10389:10593, ack 504, win 519, options [nop,nop,TS val 1139708313 ecr 299335339], length 204
02:08:21.427456 IP 138.197.147.137.22 > 99.237.196.67.52615: Flags [P.], seq 10593:10957, ack 504, win 519, options [nop,nop,TS val 1139708313 ecr 299335339], length 364
02:08:21.427540 IP 138.197.147.137.22 > 99.237.196.67.52615: Flags [P.], seq 10957:11329, ack 504, win 519, options [nop,nop,TS val 1139708313 ecr 299335339], length 372
02:08:21.427628 IP 138.197.147.137.22 > 99.237.196.67.52615: Flags [P.], seq 11329:11685, ack 504, win 519, options [nop,nop,TS val 1139708313 ecr 299335339], length 356
02:08:21.427737 IP 138.197.147.137.22 > 99.237.196.67.52615: Flags [P.], seq 11685:12057, ack 504, win 519, options [nop,nop,TS val 1139708314 ecr 299335339], length 372
02:08:21.427823 IP 138.197.147.137.22 > 99.237.196.67.52615: Flags [P.], seq 12057:12413, ack 504, win 519, options [nop,nop,TS val 1139708314 ecr 299335339], length 356
02:08:21.427874 IP 138.197.147.137.22 > 99.237.196.67.52615: Flags [P.], seq 12413:12449, ack 504, win 519, options [nop,nop,TS val 1139708314 ecr 299335339], length 36
02:08:21.437868 IP 99.237.196.67.52615 > 138.197.147.137.22: Flags [.], ack 9125, win 38814, options [nop,nop,TS val 299335354 ecr 1139708306], length 0
02:08:21.444147 IP 99.237.196.67.52615 > 138.197.147.137.22: Flags [.], ack 10957, win 38814, options [nop,nop,TS val 299335360 ecr 1139708313], length 0
02:08:21.444147 IP 99.237.196.67.52615 > 138.197.147.137.22: Flags [.], ack 12449, win 38814, options [nop,nop,TS val 299335363 ecr 1139708314], length 0
02:08:21.444147 IP 99.237.196.67.52615 > 138.197.147.137.22: Flags [P.], seq 504:540, ack 9125, win 38814, options [nop,nop,TS val 299335359 ecr 1139708306], length 36
02:08:21.444382 IP 138.197.147.137.22 > 99.237.196.67.52615: Flags [P.], seq 12449:12485, ack 540, win 519, options [nop,nop,TS val 1139708330 ecr 299335354], length 36
02:08:21.459351 IP 99.237.196.67.52615 > 138.197.147.137.22: Flags [.], ack 12485, win 38814, options [nop,nop,TS val 299335377 ecr 1139708330], length 0
02:08:21.465716 IP 99.237.196.67.52615 > 138.197.147.137.22: Flags [P.], seq 540:576, ack 12485, win 38814, options [nop,nop,TS val 299335379 ecr 1139708330], length 36
02:08:21.465921 IP 138.197.147.137.22 > 99.237.196.67.52615: Flags [P.], seq 12485:12521, ack 576, win 519, options [nop,nop,TS val 1139708352 ecr 299335379], length 36
02:08:21.478870 IP 99.237.196.67.52615 > 138.197.147.137.22: Flags [.], ack 12521, win 38814, options [nop,nop,TS val 299335398 ecr 1139708352], length 0
02:08:21.485227 IP 99.237.196.67.52615 > 138.197.147.137.22: Flags [P.], seq 576:612, ack 12521, win 38814, options [nop,nop,TS val 299335400 ecr 1139708352], length 36
02:08:21.485380 IP 138.197.147.137.22 > 99.237.196.67.52615: Flags [P.], seq 12521:12557, ack 612, win 519, options [nop,nop,TS val 1139708371 ecr 299335400], length 36
02:08:21.504625 IP 99.237.196.67.52615 > 138.197.147.137.22: Flags [P.], seq 612:648, ack 12557, win 38814, options [nop,nop,TS val 299335420 ecr 1139708371], length 36
02:08:21.504626 IP 99.237.196.67.52615 > 138.197.147.137.22: Flags [.], ack 12557, win 38814, options [nop,nop,TS val 299335418 ecr 1139708371], length 0
02:08:21.504808 IP 138.197.147.137.22 > 99.237.196.67.52615: Flags [P.], seq 12557:12593, ack 648, win 519, options [nop,nop,TS val 1139708391 ecr 299335420], length 36
02:08:21.517637 IP 99.237.196.67.52615 > 138.197.147.137.22: Flags [.], ack 12593, win 38814, options [nop,nop,TS val 299335437 ecr 1139708391], length 0
02:08:21.524010 IP 99.237.196.67.52615 > 138.197.147.137.22: Flags [P.], seq 648:684, ack 12593, win 38814, options [nop,nop,TS val 299335442 ecr 1139708391], length 36
02:08:21.524177 IP 138.197.147.137.22 > 99.237.196.67.52615: Flags [P.], seq 12593:12629, ack 684, win 519, options [nop,nop,TS val 1139708410 ecr 299335442], length 36
02:08:21.531105 IP 138.197.147.137.22 > 99.237.196.67.52615: Flags [P.], seq 12629:15525, ack 684, win 519, options [nop,nop,TS val 1139708417 ecr 299335442], length 2896
02:08:21.531123 IP 138.197.147.137.22 > 99.237.196.67.52615: Flags [P.], seq 15525:16761, ack 684, win 519, options [nop,nop,TS val 1139708417 ecr 299335442], length 1236
02:08:21.531239 IP 138.197.147.137.22 > 99.237.196.67.52615: Flags [P.], seq 16761:17021, ack 684, win 519, options [nop,nop,TS val 1139708417 ecr 299335442], length 260
02:08:21.550046 IP 99.237.196.67.52615 > 138.197.147.137.22: Flags [P.], seq 684:720, ack 12629, win 38814, options [nop,nop,TS val 299335462 ecr 1139708410], length 36
02:08:21.550046 IP 99.237.196.67.52615 > 138.197.147.137.22: Flags [.], ack 12629, win 38814, options [nop,nop,TS val 299335462 ecr 1139708410], length 0
02:08:21.550046 IP 99.237.196.67.52615 > 138.197.147.137.22: Flags [.], ack 17021, win 38814, options [nop,nop,TS val 299335465 ecr 1139708417], length 0
02:08:21.550223 IP 138.197.147.137.22 > 99.237.196.67.52615: Flags [P.], seq 17021:17057, ack 720, win 519, options [nop,nop,TS val 1139708436 ecr 299335462], length 36
02:08:21.565211 IP 99.237.196.67.52615 > 138.197.147.137.22: Flags [.], ack 17057, win 38814, options [nop,nop,TS val 299335483 ecr 1139708436], length 0
02:08:21.565211 IP 99.237.196.67.52615 > 138.197.147.137.22: Flags [P.], seq 720:756, ack 17057, win 38814, options [nop,nop,TS val 299335483 ecr 1139708436], length 36
02:08:21.565382 IP 138.197.147.137.22 > 99.237.196.67.52615: Flags [P.], seq 17057:17093, ack 756, win 519, options [nop,nop,TS val 1139708451 ecr 299335483], length 36
02:08:21.578144 IP 99.237.196.67.52615 > 138.197.147.137.22: Flags [P.], seq 756:792, ack 17093, win 38814, options [nop,nop,TS val 299335503 ecr 1139708451], length 36
02:08:21.578145 IP 99.237.196.67.52615 > 138.197.147.137.22: Flags [.], ack 17093, win 38814, options [nop,nop,TS val 299335498 ecr 1139708451], length 0
02:08:21.578226 IP 138.197.147.137.22 > 99.237.196.67.52615: Flags [.], ack 792, win 519, options [nop,nop,TS val 1139708464 ecr 299335503], length 0
02:08:21.578337 IP 138.197.147.137.22 > 99.237.196.67.52615: Flags [P.], seq 17093:17129, ack 792, win 519, options [nop,nop,TS val 1139708464 ecr 299335503], length 36
02:08:21.593227 IP 99.237.196.67.52615 > 138.197.147.137.22: Flags [.], ack 17129, win 38814, options [nop,nop,TS val 299335511 ecr 1139708464], length 0
02:08:21.608290 IP 99.237.196.67.52615 > 138.197.147.137.22: Flags [P.], seq 792:828, ack 17129, win 38814, options [nop,nop,TS val 299335526 ecr 1139708464], length 36
02:08:21.608442 IP 138.197.147.137.22 > 99.237.196.67.52615: Flags [P.], seq 17129:17165, ack 828, win 519, options [nop,nop,TS val 1139708494 ecr 299335526], length 36
02:08:21.632103 IP 99.237.196.67.52615 > 138.197.147.137.22: Flags [P.], seq 828:864, ack 17165, win 38814, options [nop,nop,TS val 299335549 ecr 1139708494], length 36
02:08:21.632103 IP 99.237.196.67.52615 > 138.197.147.137.22: Flags [.], ack 17165, win 38814, options [nop,nop,TS val 299335541 ecr 1139708494], length 0
02:08:21.632271 IP 138.197.147.137.22 > 99.237.196.67.52615: Flags [P.], seq 17165:17201, ack 864, win 519, options [nop,nop,TS val 1139708518 ecr 299335549], length 36
02:08:21.634878 IP 138.197.147.137.22 > 99.237.196.67.52615: Flags [P.], seq 17201:17413, ack 864, win 519, options [nop,nop,TS val 1139708521 ecr 299335549], length 212
02:08:21.635069 IP 138.197.147.137.22 > 99.237.196.67.52615: Flags [P.], seq 17413:18441, ack 864, win 519, options [nop,nop,TS val 1139708521 ecr 299335549], length 1028
02:08:21.635214 IP 138.197.147.137.22 > 99.237.196.67.52615: Flags [P.], seq 18441:18973, ack 864, win 519, options [nop,nop,TS val 1139708521 ecr 299335549], length 532
02:08:21.635290 IP 138.197.147.137.22 > 99.237.196.67.52615: Flags [P.], seq 18973:19489, ack 864, win 519, options [nop,nop,TS val 1139708521 ecr 299335549], length 516
02:08:21.635361 IP 138.197.147.137.22 > 99.237.196.67.52615: Flags [P.], seq 19489:20021, ack 864, win 519, options [nop,nop,TS val 1139708521 ecr 299335549], length 532
02:08:21.635418 IP 138.197.147.137.22 > 99.237.196.67.52615: Flags [P.], seq 20021:20401, ack 864, win 519, options [nop,nop,TS val 1139708521 ecr 299335549], length 380
02:08:21.635480 IP 138.197.147.137.22 > 99.237.196.67.52615: Flags [P.], seq 20401:20765, ack 864, win 519, options [nop,nop,TS val 1139708521 ecr 299335549], length 364
02:08:21.635516 IP 138.197.147.137.22 > 99.237.196.67.52615: Flags [P.], seq 20765:20801, ack 864, win 519, options [nop,nop,TS val 1139708521 ecr 299335549], length 36
02:08:21.647408 IP 99.237.196.67.52615 > 138.197.147.137.22: Flags [.], ack 17201, win 38814, options [nop,nop,TS val 299335565 ecr 1139708518], length 0
02:08:21.653669 IP 99.237.196.67.52615 > 138.197.147.137.22: Flags [.], ack 18973, win 38814, options [nop,nop,TS val 299335568 ecr 1139708521], length 0
02:08:21.653670 IP 99.237.196.67.52615 > 138.197.147.137.22: Flags [.], ack 20801, win 38814, options [nop,nop,TS val 299335569 ecr 1139708521], length 0
02:08:21.653670 IP 99.237.196.67.52615 > 138.197.147.137.22: Flags [P.], seq 864:900, ack 20801, win 38814, options [nop,nop,TS val 299335571 ecr 1139708521], length 36
02:08:21.653880 IP 138.197.147.137.22 > 99.237.196.67.52615: Flags [P.], seq 20801:20837, ack 900, win 519, options [nop,nop,TS val 1139708540 ecr 299335571], length 36
02:08:21.670051 IP 172.69.214.144.14172 > 138.197.147.137.59357: Flags [S], seq 1834863678, win 65535, options [mss 1460,sackOK,TS val 1627281046 ecr 0,nop,wscale 13], length 0
02:08:21.675292 IP 99.237.196.67.52615 > 138.197.147.137.22: Flags [P.], seq 900:936, ack 20837, win 38814, options [nop,nop,TS val 299335592 ecr 1139708540], length 36
02:08:21.675293 IP 99.237.196.67.52615 > 138.197.147.137.22: Flags [.], ack 20837, win 38814, options [nop,nop,TS val 299335587 ecr 1139708540], length 0
02:08:21.675468 IP 138.197.147.137.22 > 99.237.196.67.52615: Flags [P.], seq 20837:20873, ack 936, win 519, options [nop,nop,TS val 1139708561 ecr 299335592], length 36
02:08:21.688189 IP 99.237.196.67.52615 > 138.197.147.137.22: Flags [.], ack 20873, win 38814, options [nop,nop,TS val 299335608 ecr 1139708561], length 0
02:08:21.694675 IP 99.237.196.67.52615 > 138.197.147.137.22: Flags [P.], seq 936:972, ack 20873, win 38814, options [nop,nop,TS val 299335614 ecr 1139708561], length 36
02:08:21.694846 IP 138.197.147.137.22 > 99.237.196.67.52615: Flags [P.], seq 20873:20909, ack 972, win 519, options [nop,nop,TS val 1139708581 ecr 299335614], length 36
02:08:21.739221 IP 138.197.147.137.22 > 99.237.196.67.52615: Flags [P.], seq 20909:23805, ack 972, win 519, options [nop,nop,TS val 1139708625 ecr 299335614], length 2896
02:08:21.739294 IP 138.197.147.137.22 > 99.237.196.67.52615: Flags [P.], seq 23805:24289, ack 972, win 519, options [nop,nop,TS val 1139708625 ecr 299335614], length 484
02:08:21.777707 IP 138.197.147.137.22 > 99.237.196.67.52615: Flags [P.], seq 23805:24289, ack 972, win 519, options [nop,nop,TS val 1139708664 ecr 299335614], length 484
02:08:21.784398 IP 162.158.62.201.11125 > 138.197.147.137.59357: Flags [S], seq 1268707362, win 65535, options [mss 1460,sackOK,TS val 3966802962 ecr 0,nop,wscale 13], length 0
02:08:21.789709 IP 99.237.196.67.52615 > 138.197.147.137.22: Flags [.], ack 24289, win 38762, options [nop,nop,TS val 299335705 ecr 1139708625], length 0
02:08:21.789710 IP 99.237.196.67.52615 > 138.197.147.137.22: Flags [.], ack 20909, win 38814, options [nop,nop,TS val 299335705 ecr 1139708581,nop,nop,sack 1 {22357:24289}], length 0
02:08:21.789710 IP 99.237.196.67.52615 > 138.197.147.137.22: Flags [.], ack 24289, win 38814, options [nop,nop,TS val 299335705 ecr 1139708625], length 0
02:08:21.789767 IP 99.237.196.67.52615 > 138.197.147.137.22: Flags [.], ack 24289, win 38814, options [nop,nop,TS val 299335711 ecr 1139708664,nop,nop,sack 1 {23805:24289}], length 0
02:08:21.789767 IP 99.237.196.67.52615 > 138.197.147.137.22: Flags [P.], seq 972:1008, ack 20873, win 38814, options [nop,nop,TS val 299335640 ecr 1139708561], length 36
02:08:21.789767 IP 99.237.196.67.52615 > 138.197.147.137.22: Flags [P.], seq 1008:1044, ack 20873, win 38814, options [nop,nop,TS val 299335663 ecr 1139708561], length 36
02:08:21.789767 IP 99.237.196.67.52615 > 138.197.147.137.22: Flags [P.], seq 1044:1080, ack 20873, win 38814, options [nop,nop,TS val 299335689 ecr 1139708561], length 36
02:08:21.789841 IP 138.197.147.137.22 > 99.237.196.67.52615: Flags [.], ack 1080, win 519, options [nop,nop,TS val 1139708676 ecr 299335614], length 0
02:08:21.789895 IP 138.197.147.137.22 > 99.237.196.67.52615: Flags [P.], seq 24289:24397, ack 1080, win 519, options [nop,nop,TS val 1139708676 ecr 299335614], length 108
02:08:21.796354 IP 99.237.196.67.52615 > 138.197.147.137.22: Flags [P.], seq 1080:1116, ack 24289, win 38814, options [nop,nop,TS val 299335710 ecr 1139708625], length 36
02:08:21.796506 IP 138.197.147.137.22 > 99.237.196.67.52615: Flags [P.], seq 24397:24433, ack 1116, win 519, options [nop,nop,TS val 1139708682 ecr 299335710], length 36